{
  "$schema": "http://json-schema.org/draft-07/schema#",
  "$id": "https://gaia-registry.github.io/schema/skill.schema.json",
  "title": "Gaia Skill Node",
  "description": "Schema for a single skill node in the Gaia skill registry DAG.",
  "type": "object",
  "required": [
    "id",
    "name",
    "type",
    "description",
    "prerequisites",
    "derivatives",
    "knownAgents",
    "status",
    "createdAt",
    "updatedAt",
    "version"
  ],
  "additionalProperties": false,
  "properties": {
    "id": {
      "type": "string",
      "pattern": "^[a-z][a-z0-9]*(-[a-z0-9]+)*$",
      "description": "Unique camelCase identifier for the skill."
    },
    "name": {
      "type": "string",
      "minLength": 1,
      "description": "Human-readable display name."
    },
    "title": {
      "type": "string",
      "description": "Optional lore title. For unclaimed ultimate skills, stored in the graph but not rendered in projections until a named implementation claims the skill."
    },
    "type": {
      "type": "string",
      "enum": [
        "basic",
        "extra",
        "unique",
        "ultimate"
      ],
      "description": "Skill classification type."
    },
    "summary": {
      "type": "string",
      "description": "A brief summary of the skill."
    },
    "description": {
      "type": "string",
      "minLength": 10,
      "description": "Clear, agent-agnostic definition of the capability."
    },
    "useCase": {
      "type": "string",
      "description": "Detailed scenario of how a developer would use this skill."
    },
    "directives": {
      "type": "string",
      "description": "Specific guidelines or rules the skill follows during execution."
    },
    "prerequisites": {
      "type": "array",
      "items": {
        "type": "string",
        "pattern": "^[a-z][a-z0-9]*(-[a-z0-9]+)*$"
      },
      "description": "Array of parent skill IDs required to unlock this skill."
    },
    "derivatives": {
      "type": "array",
      "items": {
        "type": "string",
        "pattern": "^[a-z][a-z0-9]*(-[a-z0-9]+)*$"
      },
      "description": "Array of child skill IDs that this skill contributes to."
    },
    "conditions": {
      "type": "string",
      "description": "Optional free-text conditions required for fusion or level-up."
    },
    "evidence": {
      "type": "array",
      "items": {
        "$ref": "#/definitions/evidenceEntry"
      },
      "description": "Capability-level evidence for this abstract skill (e.g. Class A / academic sources describing the generic capability). Inherited by every named skill that points at this skill via genericSkillRef; named skills may add their own implementation-specific evidence."
    },
    "knownAgents": {
      "type": "array",
      "items": {
        "type": "string"
      },
      "description": "List of known agents that demonstrate this skill."
    },
    "status": {
      "type": "string",
      "enum": [
        "provisional",
        "validated",
        "disputed",
        "deprecated"
      ],
      "description": "Current validation status of the skill."
    },
    "createdAt": {
      "type": "string",
      "format": "date",
      "description": "ISO 8601 date when the skill was first added."
    },
    "updatedAt": {
      "type": "string",
      "format": "date",
      "description": "ISO 8601 date of last modification."
    },
    "version": {
      "type": "string",
      "pattern": "^\\d+\\.\\d+\\.\\d+$",
      "description": "Semantic version of this skill definition."
    },
    "timeline": {
      "type": "array",
      "items": {
        "$ref": "#/definitions/timelineEvent"
      },
      "description": "Chronological history of meta-changes for this canonical skill."
    },
    "verification": {
      "type": "object",
      "additionalProperties": false,
      "description": "Verification tier state for this skill. Recomputed by `gaia dev verify-tier` and surfaced in `gaia skills info`. The `tier` field stores the highest tier currently satisfied (or null); `firstEvidenceAt` is the tenure baseline for the enterprise-ready tier.",
      "properties": {
        "tier": {
          "type": [
            "string",
            "null"
          ],
          "enum": [
            null,
            "community-verified",
            "benchmark-verified",
            "security-reviewed",
            "enterprise-ready"
          ],
          "description": "Highest verification tier this skill currently satisfies, or null if no tier is met."
        },
        "tierEvaluatedAt": {
          "type": "string",
          "format": "date-time",
          "description": "ISO 8601 timestamp of the most recent tier recomputation."
        },
        "firstEvidenceAt": {
          "type": "string",
          "format": "date-time",
          "description": "ISO 8601 timestamp of the first `evidence_added` event. Used as the tenure baseline for the enterprise-ready tier."
        }
      }
    },
    "trustMagnitude": {
      "type": "number",
      "minimum": 0,
      "description": "G7 Trust Magnitude — unbounded aggregate artifact score computed from the 10-type evidence taxonomy (RFC §3). Sum of per-evidence artifact scores (magnitude × weight × freshness). Display layer soft-caps at 500; raw value drives grading and the apex gate. Replaces the legacy trustNumber aggregate."
    },
    "overallTrustGrade": {
      "type": "string",
      "enum": [
        "S",
        "A",
        "B",
        "C",
        "ungraded"
      ],
      "description": "G7 Overall Trust Grade derived from trustMagnitude thresholds and diversity gate (RFC §4): S ≥ 250, A ≥ 100, B ≥ 50, C ≥ 20, ungraded < 20. Requires meeting the diversity gate (distinct evidence types, non-self-producible rule) in addition to the magnitude floor."
    },
    "provisional": {
      "type": "boolean",
      "default": false,
      "description": "True if this skill is graded at its current overallTrustGrade under the 6-month provisional grace window (RFC §5.7). A provisional skill passed the magnitude threshold for its grade but failed the diversity gate at G7 migration cutover. Demotion at grace expiry is PR-gated, not automatic."
    },
    "provisionalUntil": {
      "type": "string",
      "format": "date",
      "description": "ISO date when the provisional grace window expires. Populated only when provisional=true. After this date gaia validate emits a provisional-expired warning; demotion requires a curator PR."
    },
    "apexGateStatus": {
      "type": "object",
      "description": "Reserved for forward-compat with namedSkill propagation — unused on canonical nodes. Per-predicate pass/fail for the 6★ apex gate (RFC §11.12, amended by G7 delta §A). All 6 active predicates must be true simultaneously for apex eligibility. Two additional predicates are feature-flagged OFF (return null = skipped) until 2026-Q4 review.",
      "additionalProperties": false,
      "properties": {
        "aGradedOriginsGte5": {
          "type": [
            "boolean",
            "null"
          ],
          "description": "TRUE if the skill's transitive fusion-recipe closure contains ≥5 distinct A-or-S-graded origin evidence rows. Consolidates the old transitiveOriginsGte12 and aGradedClosureGte8 predicates (delta §A)."
        },
        "sourceTenureDaysGte180AorS": {
          "type": [
            "boolean",
            "null"
          ],
          "description": "TRUE if the maximum source age across all A/S-tier evidence rows is ≥180 calendar days, measured via the per-row sourceStartedAt field. Replaces the old tenureDaysGte180 predicate (delta §A). False (not null) when no A/S rows exist."
        },
        "directNestedSuiteGte1": {
          "type": [
            "boolean",
            "null"
          ],
          "description": "TRUE if at least one direct component of this skill itself has non-empty suiteComponents (RFC §11.12.2)."
        },
        "depth2OnlyReachableGte1": {
          "type": [
            "boolean",
            "null"
          ],
          "description": "TRUE if the fusion graph (role=origin edges, excluding suite-component edges) contains at least one skill reachable only at depth-2 and not at depth-1 (RFC §11.12.3, delta §A depth-2 walk amendment)."
        },
        "overallGradeS": {
          "type": [
            "boolean",
            "null"
          ],
          "description": "TRUE if overallTrustGrade equals S under strict-evidence reading (anti-auto-mint per RFC §10.14; only fusion-recipe may be auto-derived)."
        },
        "apexPromotionPrSigned": {
          "type": [
            "boolean",
            "null"
          ],
          "description": "TRUE if a PR labeled apex-promotion exists with ≥2 distinct 4★+ verifier approvals from at least 2 distinct GitHub orgs (RFC §11.12.8). gaia promote rejects target_level==6★ at CLI layer; this predicate is set only by meta-guard.yml at merge time."
        },
        "crossOrgVerifierGte2": {
          "type": [
            "boolean",
            "null"
          ],
          "description": "FEATURE-FLAGGED OFF until 2026-Q4 review. When active: TRUE if ≥2 verifier-attestation rows exist from 4★+ verifiers in at least 2 distinct GitHub orgs (RFC §11.12.6). Returns null (skipped) while flag is off; CI cap in I4 enforces the system-wide limit independently."
        },
        "systemWideCapRespected": {
          "type": [
            "boolean",
            "null"
          ],
          "description": "FEATURE-FLAGGED OFF. System-wide 6★ cap (≤5) is enforced by meta-guard.yml CI (I4), not by this per-skill predicate. Returns null (skipped). Kept for forward compatibility; re-enable by flipping the feature flag in src/gaia_cli/trustMagnitude.py at 2026-Q4 review."
        }
      }
    }
  },
  "definitions": {
    "evidenceEntry": {
      "type": "object",
      "required": [
        "source",
        "evaluator",
        "date"
      ],
      "additionalProperties": false,
      "properties": {
        "type": {
          "type": "string",
          "pattern": "^[a-z0-9]+(-[a-z0-9]+)*$",
          "description": "Evidence Type — the provenance of the demonstration (where it came from, not how strong it is). Kebab-case, validated against meta.json evidence.types (initially arxiv, repo, github-stars); list-driven so new types can be added in meta.json without a schema change. Carries the provenance meaning that the deprecated `class` field used to conflate. Distinct from the skill `type` taxonomy (basic/extra/unique/ultimate)."
        },
        "grade": {
          "type": "string",
          "enum": [
            "S",
            "A",
            "B",
            "C"
          ],
          "description": "per-evidence grade (S/A/B/C). Distinct from the skill's overall trust grade (overallTrustGrade). Used by the diversity gate per RFC §4. Evidence whose trustNumber is below 40 is ungraded: this field is absent and the entry counts toward no gate. WARNING: grade A/B are NOT the deprecated class A/B — migration code must never read one as the other."
        },
        "trustNumber": {
          "type": "number",
          "minimum": 0,
          "maximum": 100,
          "description": "Internal 0–100 trust score that the Evidence Grade derives from via meta.json evidence.gradeThresholds. Not user-facing; surfaces show the grade, never the raw number."
        },
        "class": {
          "type": "string",
          "enum": [
            "A",
            "B",
            "C"
          ],
          "description": "DEPRECATED — removed at the next major release. Legacy single axis that conflated provenance and quality into one letter (A peer-reviewed, B reproducible demo, C credible demo). Superseded by `type` (provenance) + `grade` (quality). Class A/B are NOT grade A/B. Retained for backward compatibility until the class-to-type migration completes; no longer required."
        },
        "source": {
          "type": "string",
          "format": "uri",
          "description": "URL to the evidence source."
        },
        "evaluator": {
          "type": "string",
          "description": "GitHub username of the person who evaluated the evidence."
        },
        "date": {
          "type": "string",
          "format": "date",
          "description": "Date of evaluation."
        },
        "notes": {
          "type": "string",
          "description": "Optional notes about the evaluation."
        },
        "verified": {
          "type": "boolean",
          "description": "True if the evidence has been verified by a Verifier (4★+ contributor)."
        },
        "disputed": {
          "type": "boolean",
          "description": "True if the evidence is currently under dispute."
        },
        "verificationSource": {
          "type": "string",
          "format": "uri",
          "description": "URL to the verification discussion or PR."
        },
        "sourceStartedAt": {
          "type": "string",
          "format": "date",
          "description": "ISO date the source project/repo/publication was first created or published. Optional for B/C/ungraded rows. Required at A/S tier for apex eligibility (gaia validate warns on A/S rows missing this field; hard-fail is I4's job post-cutover). Used by the sourceTenureDaysGte180AorS apex predicate."
        },
        "unverified": {
          "type": "boolean",
          "description": "Interim flag for proxy-containment entries whose claim has not yet been validated by the proxy-containment validator (RFC §11.2). Entry counts at full magnitude while flagged; surfaced in gaia evidence listings and audit reports."
        },
        "layer": {
          "type": "string",
          "enum": [
            "generic",
            "named"
          ],
          "description": "The layer at which this evidence row is attached. Defaults to the layer of the containing skill node — generic skills default to 'generic', named skills default to 'named'. Used by the per-type allowedLayers validator and the inheritance multiplier."
        },
        "links": {
          "type": "object",
          "additionalProperties": false,
          "description": "Per-evidence-entry links used by the trust magnitude computation.",
          "properties": {
            "canonicalRepo": {
              "type": "string",
              "format": "uri",
              "description": "Canonical upstream repository URL for fork-network canonicalization opt-out (RFC §11.5). When set, this evidence entry's star pool is attributed to this URL rather than the auto-detected upstream fork. Required when a fork has legitimately diverged into a separate skill."
            }
          }
        },
        "cosigners": {
          "type": "array",
          "description": "Verifier co-signers for social-signal recognized-voice (1.2× creator multiplier) and cross-org verifier-attestation requirements. Each cosigner must be a 4★+ verifier from a distinct GitHub org. Recorded via gaia dev evidence --cosign-with <verifier>.",
          "items": {
            "type": "object",
            "required": [
              "username",
              "org",
              "signedAt"
            ],
            "additionalProperties": false,
            "properties": {
              "username": {
                "type": "string",
                "pattern": "^[a-zA-Z0-9][a-zA-Z0-9-]*$",
                "description": "GitHub username of the co-signing verifier."
              },
              "org": {
                "type": "string",
                "description": "GitHub org the verifier belongs to at co-sign time (used for cross-org distinctness check)."
              },
              "signedAt": {
                "type": "string",
                "format": "date-time",
                "description": "ISO 8601 timestamp when the co-sign was recorded."
              }
            }
          }
        }
      }
    },
    "timelineEvent": {
      "type": "object",
      "required": [
        "timestamp",
        "action"
      ],
      "additionalProperties": false,
      "properties": {
        "timestamp": {
          "type": "string",
          "format": "date-time",
          "description": "ISO 8601 date-time of the event."
        },
        "action": {
          "type": "string",
          "enum": [
            "rank_up",
            "fuse",
            "propose",
            "name",
            "demote",
            "ascend",
            "rejected",
            "merge",
            "split",
            "rename",
            "add",
            "evidence_added",
            "evidence_removed",
            "evidence_graded",
            "type_change",
            "verified",
            "disputed",
            "security_scan_passed",
            "apex_pr_signed"
          ],
          "description": "The meta-action that occurred."
        },
        "contributor": {
          "type": "string",
          "pattern": "^[a-zA-Z0-9][a-zA-Z0-9-]*$",
          "description": "The GitHub username responsible for the change."
        },
        "details": {
          "type": "string",
          "description": "Additional context or human-readable details."
        },
        "previousValue": {
          "type": [
            "string",
            "null"
          ],
          "description": "The level/status before this event (e.g. '2★'). Null for first-time events such as 'add'."
        },
        "newValue": {
          "type": "string",
          "description": "The level/status after this event (e.g. '3★')."
        }
      }
    }
  },
  "allOf": [
    {
      "if": {
        "properties": {
          "type": {
            "const": "basic"
          }
        }
      },
      "then": {
        "properties": {
          "prerequisites": {
            "maxItems": 0
          }
        }
      }
    },
    {
      "if": {
        "properties": {
          "type": {
            "const": "extra"
          }
        }
      },
      "then": {
        "properties": {
          "prerequisites": {
            "minItems": 2
          }
        }
      }
    },
    {
      "if": {
        "properties": {
          "type": {
            "const": "ultimate"
          }
        }
      },
      "then": {
        "properties": {
          "prerequisites": {
            "minItems": 3
          }
        }
      }
    },
    {
      "if": {
        "properties": {
          "type": {
            "const": "unique"
          }
        }
      },
      "then": {
        "properties": {
          "prerequisites": {
            "maxItems": 0
          }
        }
      }
    }
  ]
}
