{
  "id": "audience-model",
  "name": "Audience Model",
  "type": "basic",
  "description": "Adapts tone, complexity, and framing of output to match a target audience profile.",
  "prerequisites": [],
  "derivatives": [
    "ghostwrite",
    "translation-pipeline",
    "humanize-prose"
  ],
  "conditions": "",
  "evidence": [],
  "knownAgents": [],
  "status": "provisional",
  "createdAt": "2026-04-26",
  "updatedAt": "2026-06-02",
  "version": "0.1.0",
  "timeline": [
    {
      "timestamp": "2026-05-13T21:50:25Z",
      "action": "propose",
      "contributor": "mbtiongson1",
      "details": "Skill created as 1★ (provisional)",
      "previousValue": null,
      "newValue": "1★"
    },
    {
      "timestamp": "2026-05-25T04:25:30Z",
      "action": "demote",
      "contributor": "mbtiongson1",
      "details": "Calibrated level from 1★ to 0★"
    },
    {
      "timestamp": "2026-05-25T04:44:23Z",
      "action": "demote",
      "contributor": "mbtiongson1",
      "details": "Calibrated/demoted rank from 1★ to 0★",
      "previousValue": "1★",
      "newValue": "0★"
    },
    {
      "timestamp": "2026-06-02T23:45:10Z",
      "action": "evidence_removed",
      "contributor": "unknown",
      "details": "Removed dead/invalid evidence: https://github.com/gaia-registry/gaia/blob/main/docs/evidence/audienceModel.md"
    }
  ]
}
