{
  "id": "worker-agent-dispatch",
  "name": "Worker Agent Dispatch",
  "type": "basic",
  "description": "Maps trigger events to optimal agent combinations for background task execution with performance tracking and continuous feedback.",
  "prerequisites": [],
  "derivatives": [],
  "conditions": "",
  "evidence": [],
  "knownAgents": [],
  "status": "provisional",
  "createdAt": "2026-05-19",
  "updatedAt": "2026-06-01",
  "version": "0.1.0",
  "timeline": [
    {
      "timestamp": "2026-05-19T16:29:16Z",
      "action": "propose",
      "contributor": "claude",
      "details": "Skill created as 2★ (provisional)",
      "previousValue": null,
      "newValue": "2★"
    }
  ]
}
