{
  "id": "e2e-testing",
  "name": "End-to-End Testing",
  "type": "extra",
  "description": "Execute full end-to-end user journey tests using browser automation frameworks (Playwright/Puppeteer), validating complete workflows from UI to backend across real environments.",
  "prerequisites": [
    "browser-automation",
    "automated-testing"
  ],
  "derivatives": [
    "founder-mode-orchestration"
  ],
  "conditions": "Requires a live or containerised target environment; browser automation must be available.",
  "evidence": [
    {
      "class": "B",
      "source": "https://github.com/zachblume/autospec",
      "evaluator": "mbtiongson1",
      "date": "2026-04-30",
      "notes": "autospec — AI agent that takes a web app URL and autonomously QAs it, saving passing specs as E2E test code (59 stars, active). (backfilled — class-to-type migration)",
      "type": "repo",
      "trustNumber": 70.0
    }
  ],
  "knownAgents": [],
  "status": "provisional",
  "createdAt": "2026-04-30",
  "updatedAt": "2026-06-21",
  "version": "0.2.0",
  "timeline": [
    {
      "timestamp": "2026-05-13T21:50:25Z",
      "action": "propose",
      "contributor": "mbtiongson1",
      "details": "Skill created as 3★ (provisional)",
      "previousValue": null,
      "newValue": "3★"
    },
    {
      "timestamp": "2026-06-14T07:08:59Z",
      "action": "evidence_graded",
      "contributor": "unknown",
      "details": "Re-graded evidence from https://github.com/zachblume/autospec as B (trustNumber: 70.0)"
    }
  ]
}
