{
  "id": "agent-memory-platform",
  "name": "Agent Memory Platform",
  "type": "extra",
  "description": "Complete AgentDB vector memory ecosystem: QUIC-synchronized distributed vector storage, adaptive pattern learning, memory pattern design, database optimization, and semantic vector search.",
  "prerequisites": [
    "distributed-vector-memory",
    "agent-memory-learning",
    "memory-pattern-design",
    "vector-db-optimization",
    "vector-search"
  ],
  "derivatives": [],
  "conditions": "Requires demonstrating all 5 AgentDB discipline skills in a production distributed system context.",
  "evidence": [],
  "knownAgents": [],
  "status": "provisional",
  "createdAt": "2026-05-19",
  "updatedAt": "2026-06-20",
  "version": "0.1.0",
  "timeline": [
    {
      "timestamp": "2026-05-19T00:00:00Z",
      "action": "fuse",
      "contributor": "mbtiongson1",
      "details": "Fused 5 ruvnet/agentdb discipline skills into /agent-memory-platform ultimate. Components: distributed-vector-memory, agent-memory-learning, memory-pattern-design, vector-db-optimization, vector-search. Promoted to 5★ on evidence: ruvnet/ruflo — 34k+ stars, AgentDB production deployment."
    },
    {
      "timestamp": "2026-05-19T16:29:16Z",
      "action": "propose",
      "contributor": "claude",
      "details": "Skill created as 5★ (provisional)",
      "previousValue": null,
      "newValue": "5★"
    },
    {
      "timestamp": "2026-06-20T06:47:47Z",
      "action": "type_change",
      "contributor": "mbtiongson1",
      "details": "Reclassified from ultimate to extra"
    }
  ]
}
