{
  "id": "using-git-worktrees",
  "name": "Using Git Worktrees",
  "type": "extra",
  "description": "Ensures work happens in an isolated workspace via native tools or git worktree fallback before starting feature work.",
  "prerequisites": [
    "code-execution",
    "tool-use"
  ],
  "derivatives": [
    "superpowers"
  ],
  "conditions": "",
  "evidence": [],
  "knownAgents": [],
  "status": "provisional",
  "createdAt": "2026-05-18",
  "updatedAt": "2026-06-01",
  "version": "0.1.0",
  "timeline": [
    {
      "timestamp": "2026-05-18T14:11:08Z",
      "action": "propose",
      "contributor": "mbtiongson1",
      "details": "Skill created as 1★ (provisional)",
      "previousValue": null,
      "newValue": "1★"
    },
    {
      "timestamp": "2026-05-19T13:55:59Z",
      "action": "type_change",
      "contributor": "mbtiongson1",
      "details": "Type adjusted from basic to extra",
      "previousValue": "basic",
      "newValue": "extra"
    }
  ]
}
