{
  "id": "logical-inference",
  "name": "Logical Inference",
  "type": "basic",
  "description": "Applies deductive, inductive, or abductive reasoning to derive valid conclusions from premises and structured knowledge.",
  "prerequisites": [],
  "derivatives": [
    "knowledge-graph-build",
    "multimodal-reasoning"
  ],
  "conditions": "",
  "evidence": [
    {
      "class": "A",
      "source": "https://arxiv.org/abs/2201.11903",
      "evaluator": "mbtiongson1",
      "date": "2026-04-28",
      "notes": "Chain-of-Thought prompting (Wei et al.) â€” few-shot CoT elicits multi-step reasoning; +18% on GSM8K and +15% on SVAMP over standard prompting. (backfilled — class-to-type migration)",
      "type": "arxiv",
      "trustNumber": 85.0,
      "grade": "A"
    }
  ],
  "knownAgents": [],
  "status": "provisional",
  "createdAt": "2026-04-28",
  "updatedAt": "2026-06-14",
  "version": "0.2.0",
  "timeline": [
    {
      "timestamp": "2026-05-13T21:50:25Z",
      "action": "propose",
      "contributor": "mbtiongson1",
      "details": "Skill created as 1★ (provisional)",
      "previousValue": null,
      "newValue": "1★"
    },
    {
      "timestamp": "2026-06-14T07:08:51Z",
      "action": "evidence_graded",
      "contributor": "unknown",
      "details": "Re-graded evidence from https://arxiv.org/abs/2201.11903 as A (trustNumber: 85.0)"
    }
  ]
}
