{
  "id": "guardrails",
  "name": "Guardrails",
  "type": "extra",
  "description": "Wraps LLM outputs with programmatic safety rules, content filters, and topical constraints that detect policy violations and enforce compliant, on-policy responses before they reach the user.",
  "prerequisites": [
    "evaluate-output",
    "classify",
    "structured-output"
  ],
  "derivatives": [
    "founder-mode-orchestration"
  ],
  "conditions": "Requires a defined policy schema and an evaluation loop.",
  "evidence": [
    {
      "class": "A",
      "source": "https://arxiv.org/abs/2603.25176",
      "evaluator": "mbtiongson1",
      "date": "2026-04-30",
      "notes": "Prompt Attack Detection with LLM-as-a-Judge (2026) -- guardrail deployment framework for detecting jailbreaks and prompt injections under production latency constraints."
    },
    {
      "class": "B",
      "source": "https://github.com/NVIDIA-NeMo/Guardrails",
      "evaluator": "mbtiongson1",
      "date": "2026-04-30",
      "notes": "NeMo Guardrails -- open-source toolkit for adding programmable safety rails to LLM-based conversational systems; actively maintained."
    }
  ],
  "knownAgents": [],
  "status": "provisional",
  "createdAt": "2026-04-30",
  "updatedAt": "2026-06-01",
  "version": "0.1.0",
  "timeline": [
    {
      "timestamp": "2026-05-13T21:50:25Z",
      "action": "propose",
      "contributor": "mbtiongson1",
      "details": "Skill created as 3★ (provisional)",
      "previousValue": null,
      "newValue": "3★"
    }
  ]
}
